{
	"$schema": "http://json-schema.org/draft-07/schema#",
	"$ref": "#/definitions/ThinkMessage",
	"definitions": {
		"NewResults": {
			"$ref": "#/definitions/AbstractResults",
			"description": "Новый результат"
		},
		"OldResults": {
			"$ref": "#/definitions/AbstractResults",
			"description": "Аннулированный результат"
		},
		"AbstractResults": {
			"description": "Массив с контентом в рамках  документа",
			"type": "array",
			"items": {
				"type": "object",
				"properties": {
					"version": {
						"type": [
							"string",
							"null"
						]
					},
					"login": {
						"type": [
							"string",
							"null"
						]
					},
					"documentCommittedDate": {
						"type": [
							"string",
							"null"
						]
					},
					"composition_": {
						"$ref": "#/definitions/Composition"
					}
				},
				"required": [
					"composition_"
				]
			}
		},
		"Composition": {
			"description": "Контент документа(Композиция)",
			"type": "object",
			"properties": {
				"content": {
					"$ref": "#/definitions/Content"
				},
				"context": {
					"$ref": "#/definitions/Context"
				}
			},
			"required": [
				"content",
				"context"
			]
		},
		"ThinkMessage": {
			"description": "valiadtion message",
			"type": "object",
			"properties": {
				"domain": {
					"description": "Домен ",
					"type": "string"
				},
				"ehrUid": {
					"description": "Юид",
					"type": "string"
				},
				"operationType": {
					"description": "Тип операции",
					"type": "string",
					"enum": [
						"create",
						"update",
						"delete"
					]
				},
				"eventName": {
					"description": "Триггер",
					"type": "string"
				},
				"compositionId": {
					"description": "Идентификатор композиции",
					"type": "string"
				},
				"newResults": {
					"$ref": "#/definitions/NewResults"
				},
				"oldResults": {
					"$ref": "#/definitions/OldResults"
				},
				"comment": {
					"description": "Комментарий",
					"type": "string"
				}
			},
			"required": [
				"operationType",
				"eventName",
				"compositionId"
			],
			"additionalProperties": false,
			"oneOf": [
				{
					"properties": {
						"operationType": {
							"type": "string",
							"enum": [
								"create",
								"update"
							]
						}
					},
					"required": [
						"newResults"
					]
				},
				{
					"properties": {
						"operationType": {
							"type": "string",
							"enum": [
								"delete"
							]
						}
					},
					"required": [
						"oldResults"
					]
				}
			]
		},
		"Content": {
			"type": "array",
			"minItems": 1,
			"items": {
				"type": "object"
			},
			"contains": {
				"$ref": "#/definitions/CorrectDiagnosis"
			},
			"minContains": 1
		},
		"Context": {
			"type": "object",
			"properties": {
				"other_context": {
					"type": "object",
					"properties": {
						"items": {
							"type": "array",
							"minItems": 1,
							"items": {
								"type": "object",
								"minItems": 1,
								
                                "minContains":1,
								"required": [
									"items"
								]
							},
                            "contains": {"$ref":"#/definitions/CorrectOtherContext"}  
						}
					},
					"required": [
						"items"
					]
				}
			},
			"required": [
				"other_context"
			]
		},
		"CorrectOtherContext": {
			"type": "object",
			"properties": {
				"items": {
					"type": "array",
					"minItems": 1,
					"items": {
						"type": "object"
					},
					"allOf": [
						{
							"contains": {
								"$ref": "#/definitions/PatientId"
							}
						},
						{
							"contains": {
								"$ref": "#/definitions/DocumentId"
							}
						}
					]
				}
			}
		},
		"CorrectDiagnosis": {
			"type": "object",
			"properties": {
				"name": {
					"type": "object",
					"properties": {
						"value": {
							"type": "string",
							"enum": [
								"Диагноз",
								"Диагноз при выписке",
								"Диспансерное наблюдение",
								"Выписка из ИБ",
								"Диагноз при выписке из санаторно-курортной организации (основное заболевание)",
								"Состояние здоровья по результатам проведения настоящего профилактического осмотра/диспансеризации",
                                "Диагноз наблюдения пациента"
							]
						}
					},
					"required": [
						"value"
					]
				}
			},
			"required": [
				"name"
			]
		},
		"DocumentId": {
			"type": "object",
			"properties": {
				"name": {
					"type": "object",
					"properties": {
						"value": {
							"type": "string",
							"pattern": "ИД документа"
						}
					},
					"required": [
						"value"
					]
				},
				"value": {
					"type": "object",
					"properties": {
						"id": {
							"type": "string"
						}
					},
					"required": [
						"id"
					]
				}
			},
			"required": [
				"name",
				"value"
			]
		},
		"PatientId": {
			"type": "object",
			"properties": {
				"name": {
					"type": "object",
					"properties": {
						"value": {
							"type": "string",
							"pattern": "ИД пациента"
						}
					},
					"required": [
						"value"
					]
				},
				"value": {
					"type": "object",
					"properties": {
						"id": {
							"type": "string"
						}
					},
					"required": [
						"id"
					]
				}
			},
			"required": [
				"name",
				"value"
			]
		}
	}
}